{
  "$id": "https://cydetix.dev/schemas/v1/validation-result.schema.json",
  "$schema": "http://json-schema.org/draft-07/schema#",
  "type": "object",
  "properties": {
    "schemaVersion": {
      "type": "string",
      "const": "1.0.0"
    },
    "corpusId": {
      "type": "string",
      "minLength": 1
    },
    "immutableRevision": {
      "type": "string",
      "pattern": "^[a-f0-9]{40}$"
    },
    "counts": {
      "type": "object",
      "properties": {
        "total": {
          "type": "integer",
          "minimum": 0,
          "maximum": 9007199254740991
        },
        "languageCompatible": {
          "type": "integer",
          "minimum": 0,
          "maximum": 9007199254740991
        },
        "ruleCompatible": {
          "type": "integer",
          "minimum": 0,
          "maximum": 9007199254740991
        },
        "executed": {
          "type": "integer",
          "minimum": 0,
          "maximum": 9007199254740991
        },
        "truePositive": {
          "type": "integer",
          "minimum": 0,
          "maximum": 9007199254740991
        },
        "falsePositive": {
          "type": "integer",
          "minimum": 0,
          "maximum": 9007199254740991
        },
        "trueNegative": {
          "type": "integer",
          "minimum": 0,
          "maximum": 9007199254740991
        },
        "falseNegative": {
          "type": "integer",
          "minimum": 0,
          "maximum": 9007199254740991
        },
        "unknown": {
          "type": "integer",
          "minimum": 0,
          "maximum": 9007199254740991
        },
        "unsupported": {
          "type": "integer",
          "minimum": 0,
          "maximum": 9007199254740991
        },
        "notApplicable": {
          "type": "integer",
          "minimum": 0,
          "maximum": 9007199254740991
        },
        "duplicate": {
          "type": "integer",
          "minimum": 0,
          "maximum": 9007199254740991
        },
        "needsDomainContext": {
          "type": "integer",
          "minimum": 0,
          "maximum": 9007199254740991
        }
      },
      "required": [
        "total",
        "languageCompatible",
        "ruleCompatible",
        "executed",
        "truePositive",
        "falsePositive",
        "trueNegative",
        "falseNegative",
        "unknown",
        "unsupported",
        "notApplicable",
        "duplicate",
        "needsDomainContext"
      ],
      "additionalProperties": false
    },
    "metrics": {
      "type": "object",
      "properties": {
        "precision": {
          "type": "object",
          "properties": {
            "value": {
              "type": "number",
              "minimum": -1,
              "maximum": 1
            },
            "numerator": {
              "type": "integer",
              "minimum": -9007199254740991,
              "maximum": 9007199254740991
            },
            "denominator": {
              "type": "integer",
              "exclusiveMinimum": 0,
              "maximum": 9007199254740991
            }
          },
          "required": [
            "value",
            "numerator",
            "denominator"
          ],
          "additionalProperties": false
        },
        "recall": {
          "type": "object",
          "properties": {
            "value": {
              "type": "number",
              "minimum": -1,
              "maximum": 1
            },
            "numerator": {
              "type": "integer",
              "minimum": -9007199254740991,
              "maximum": 9007199254740991
            },
            "denominator": {
              "type": "integer",
              "exclusiveMinimum": 0,
              "maximum": 9007199254740991
            }
          },
          "required": [
            "value",
            "numerator",
            "denominator"
          ],
          "additionalProperties": false
        },
        "falsePositiveRate": {
          "type": "object",
          "properties": {
            "value": {
              "type": "number",
              "minimum": -1,
              "maximum": 1
            },
            "numerator": {
              "type": "integer",
              "minimum": -9007199254740991,
              "maximum": 9007199254740991
            },
            "denominator": {
              "type": "integer",
              "exclusiveMinimum": 0,
              "maximum": 9007199254740991
            }
          },
          "required": [
            "value",
            "numerator",
            "denominator"
          ],
          "additionalProperties": false
        },
        "specificity": {
          "type": "object",
          "properties": {
            "value": {
              "type": "number",
              "minimum": -1,
              "maximum": 1
            },
            "numerator": {
              "type": "integer",
              "minimum": -9007199254740991,
              "maximum": 9007199254740991
            },
            "denominator": {
              "type": "integer",
              "exclusiveMinimum": 0,
              "maximum": 9007199254740991
            }
          },
          "required": [
            "value",
            "numerator",
            "denominator"
          ],
          "additionalProperties": false
        },
        "f1": {
          "type": "object",
          "properties": {
            "value": {
              "type": "number",
              "minimum": -1,
              "maximum": 1
            },
            "numerator": {
              "type": "integer",
              "minimum": -9007199254740991,
              "maximum": 9007199254740991
            },
            "denominator": {
              "type": "integer",
              "exclusiveMinimum": 0,
              "maximum": 9007199254740991
            }
          },
          "required": [
            "value",
            "numerator",
            "denominator"
          ],
          "additionalProperties": false
        },
        "youden": {
          "type": "object",
          "properties": {
            "value": {
              "type": "number",
              "minimum": -1,
              "maximum": 1
            },
            "numerator": {
              "type": "integer",
              "minimum": -9007199254740991,
              "maximum": 9007199254740991
            },
            "denominator": {
              "type": "integer",
              "exclusiveMinimum": 0,
              "maximum": 9007199254740991
            }
          },
          "required": [
            "value",
            "numerator",
            "denominator"
          ],
          "additionalProperties": false
        },
        "limitations": {
          "type": "array",
          "items": {
            "type": "string",
            "minLength": 1
          }
        }
      },
      "required": [
        "limitations"
      ],
      "additionalProperties": false
    },
    "perRule": {
      "type": "array",
      "items": {
        "type": "object",
        "properties": {
          "ruleId": {
            "type": "string",
            "minLength": 1
          },
          "counts": {
            "type": "object",
            "properties": {
              "total": {
                "type": "integer",
                "minimum": 0,
                "maximum": 9007199254740991
              },
              "languageCompatible": {
                "type": "integer",
                "minimum": 0,
                "maximum": 9007199254740991
              },
              "ruleCompatible": {
                "type": "integer",
                "minimum": 0,
                "maximum": 9007199254740991
              },
              "executed": {
                "type": "integer",
                "minimum": 0,
                "maximum": 9007199254740991
              },
              "truePositive": {
                "type": "integer",
                "minimum": 0,
                "maximum": 9007199254740991
              },
              "falsePositive": {
                "type": "integer",
                "minimum": 0,
                "maximum": 9007199254740991
              },
              "trueNegative": {
                "type": "integer",
                "minimum": 0,
                "maximum": 9007199254740991
              },
              "falseNegative": {
                "type": "integer",
                "minimum": 0,
                "maximum": 9007199254740991
              },
              "unknown": {
                "type": "integer",
                "minimum": 0,
                "maximum": 9007199254740991
              },
              "unsupported": {
                "type": "integer",
                "minimum": 0,
                "maximum": 9007199254740991
              },
              "notApplicable": {
                "type": "integer",
                "minimum": 0,
                "maximum": 9007199254740991
              },
              "duplicate": {
                "type": "integer",
                "minimum": 0,
                "maximum": 9007199254740991
              },
              "needsDomainContext": {
                "type": "integer",
                "minimum": 0,
                "maximum": 9007199254740991
              }
            },
            "required": [
              "total",
              "languageCompatible",
              "ruleCompatible",
              "executed",
              "truePositive",
              "falsePositive",
              "trueNegative",
              "falseNegative",
              "unknown",
              "unsupported",
              "notApplicable",
              "duplicate",
              "needsDomainContext"
            ],
            "additionalProperties": false
          },
          "metrics": {
            "type": "object",
            "properties": {
              "precision": {
                "type": "object",
                "properties": {
                  "value": {
                    "type": "number",
                    "minimum": -1,
                    "maximum": 1
                  },
                  "numerator": {
                    "type": "integer",
                    "minimum": -9007199254740991,
                    "maximum": 9007199254740991
                  },
                  "denominator": {
                    "type": "integer",
                    "exclusiveMinimum": 0,
                    "maximum": 9007199254740991
                  }
                },
                "required": [
                  "value",
                  "numerator",
                  "denominator"
                ],
                "additionalProperties": false
              },
              "recall": {
                "type": "object",
                "properties": {
                  "value": {
                    "type": "number",
                    "minimum": -1,
                    "maximum": 1
                  },
                  "numerator": {
                    "type": "integer",
                    "minimum": -9007199254740991,
                    "maximum": 9007199254740991
                  },
                  "denominator": {
                    "type": "integer",
                    "exclusiveMinimum": 0,
                    "maximum": 9007199254740991
                  }
                },
                "required": [
                  "value",
                  "numerator",
                  "denominator"
                ],
                "additionalProperties": false
              },
              "falsePositiveRate": {
                "type": "object",
                "properties": {
                  "value": {
                    "type": "number",
                    "minimum": -1,
                    "maximum": 1
                  },
                  "numerator": {
                    "type": "integer",
                    "minimum": -9007199254740991,
                    "maximum": 9007199254740991
                  },
                  "denominator": {
                    "type": "integer",
                    "exclusiveMinimum": 0,
                    "maximum": 9007199254740991
                  }
                },
                "required": [
                  "value",
                  "numerator",
                  "denominator"
                ],
                "additionalProperties": false
              },
              "specificity": {
                "type": "object",
                "properties": {
                  "value": {
                    "type": "number",
                    "minimum": -1,
                    "maximum": 1
                  },
                  "numerator": {
                    "type": "integer",
                    "minimum": -9007199254740991,
                    "maximum": 9007199254740991
                  },
                  "denominator": {
                    "type": "integer",
                    "exclusiveMinimum": 0,
                    "maximum": 9007199254740991
                  }
                },
                "required": [
                  "value",
                  "numerator",
                  "denominator"
                ],
                "additionalProperties": false
              },
              "f1": {
                "type": "object",
                "properties": {
                  "value": {
                    "type": "number",
                    "minimum": -1,
                    "maximum": 1
                  },
                  "numerator": {
                    "type": "integer",
                    "minimum": -9007199254740991,
                    "maximum": 9007199254740991
                  },
                  "denominator": {
                    "type": "integer",
                    "exclusiveMinimum": 0,
                    "maximum": 9007199254740991
                  }
                },
                "required": [
                  "value",
                  "numerator",
                  "denominator"
                ],
                "additionalProperties": false
              },
              "youden": {
                "type": "object",
                "properties": {
                  "value": {
                    "type": "number",
                    "minimum": -1,
                    "maximum": 1
                  },
                  "numerator": {
                    "type": "integer",
                    "minimum": -9007199254740991,
                    "maximum": 9007199254740991
                  },
                  "denominator": {
                    "type": "integer",
                    "exclusiveMinimum": 0,
                    "maximum": 9007199254740991
                  }
                },
                "required": [
                  "value",
                  "numerator",
                  "denominator"
                ],
                "additionalProperties": false
              },
              "limitations": {
                "type": "array",
                "items": {
                  "type": "string",
                  "minLength": 1
                }
              }
            },
            "required": [
              "limitations"
            ],
            "additionalProperties": false
          }
        },
        "required": [
          "ruleId",
          "counts",
          "metrics"
        ],
        "additionalProperties": false
      }
    },
    "cases": {
      "type": "array",
      "items": {
        "type": "object",
        "properties": {
          "caseId": {
            "type": "string",
            "minLength": 1
          },
          "ruleId": {
            "type": "string",
            "minLength": 1
          },
          "path": {
            "type": "string",
            "minLength": 1
          },
          "line": {
            "type": "integer",
            "exclusiveMinimum": 0,
            "maximum": 9007199254740991
          },
          "languageCompatible": {
            "type": "boolean"
          },
          "ruleCompatible": {
            "type": "boolean"
          },
          "disposition": {
            "type": "string",
            "enum": [
              "TRUE_POSITIVE",
              "FALSE_POSITIVE",
              "TRUE_NEGATIVE",
              "FALSE_NEGATIVE",
              "EXPECTED_BUT_DUPLICATE",
              "UNKNOWN",
              "UNSUPPORTED",
              "NOT_APPLICABLE",
              "NEEDS_DOMAIN_CONTEXT"
            ]
          },
          "rationale": {
            "type": "string",
            "minLength": 1
          }
        },
        "required": [
          "caseId",
          "ruleId",
          "path",
          "languageCompatible",
          "ruleCompatible",
          "disposition",
          "rationale"
        ],
        "additionalProperties": false
      }
    }
  },
  "required": [
    "schemaVersion",
    "corpusId",
    "immutableRevision",
    "counts",
    "metrics",
    "perRule",
    "cases"
  ],
  "additionalProperties": false
}
